
--- Job cvx-sl.gms Start 02/05/26 12:14:46 50.4.1 84b10359 WEX-WEI x86 64bit/MS Windows
--- Applying:
    C:\GAMS\50\gmsprmNT.txt
--- GAMS Parameters defined
    Input C:\Users\freal\Desktop\HubSpokeNetworkDesign\4node_spain\cvx-sl.gms
    PageSize 0
    ScrDir C:\Users\freal\Desktop\HubSpokeNetworkDesign\4node_spain\225aj\
    SysDir C:\GAMS\50\
    LogOption 3
    AppendLog 1
    ErrMsg 1
    ErrorLog 99
    IDE 1
    LstTitleLeftAligned 1
Licensee: Luis Cadarso Morga                             G250911+0003Ac-GEN
          University Rey Juan Carlos                                DCE4613
          225aj\gamslice.dat
          node:23539203 mem:64 cores:8 ipport:54318 v:2                    
          Course license for use within the course and related course work
          The expiration date of time-limited license is Feb 08, 2026
System information: 8 physical cores and 64 Gb physical memory detected
GAMS 50.4.1   Copyright (C) 1987-2025 GAMS Development. All rights reserved
--- Starting compilation
--- cvx-sl.gms(2) 2 Mb
--- . param_definition_cvx-blo.gms(18) 3 Mb
--- .. demand.txt(16) 3 Mb
--- . param_definition_cvx-blo.gms(24) 3 Mb
--- .. alt_utility.txt(16) 3 Mb
--- . param_definition_cvx-blo.gms(31) 3 Mb
--- .. link_cost.txt(16) 3 Mb
--- . param_definition_cvx-blo.gms(36) 3 Mb
--- .. link_capacity_slope.txt(16) 3 Mb
--- . param_definition_cvx-blo.gms(41) 3 Mb
--- .. alfa_od.txt(16) 3 Mb
--- . param_definition_cvx-blo.gms(46) 3 Mb
--- .. beta_od.txt(16) 3 Mb
--- . param_definition_cvx-blo.gms(51) 3 Mb
--- .. prices.txt(16) 3 Mb
--- . param_definition_cvx-blo.gms(56) 3 Mb
--- .. op_link_cost.txt(16) 3 Mb
--- . param_definition_cvx-blo.gms(62) 3 Mb
--- .. candidates.txt(16) 3 Mb
--- . param_definition_cvx-blo.gms(67) 3 Mb
--- .. travel_time.txt(16) 3 Mb
--- . param_definition_cvx-blo.gms(73) 3 Mb
--- .. station_cost.txt(4) 3 Mb
--- . param_definition_cvx-blo.gms(78) 3 Mb
--- .. hub_cost.txt(4) 3 Mb
--- . param_definition_cvx-blo.gms(83) 3 Mb
--- .. station_capacity_slope.txt(4) 3 Mb
--- . param_definition_cvx-blo.gms(88) 3 Mb
--- .. budget.txt(1) 3 Mb
--- . param_definition_cvx-blo.gms(94) 3 Mb
--- .. s_prev.txt(4) 3 Mb
--- . param_definition_cvx-blo.gms(99) 3 Mb
--- .. sh_prev.txt(4) 3 Mb
--- . param_definition_cvx-blo.gms(115) 3 Mb
--- .. lam.txt(1) 3 Mb
--- . param_definition_cvx-blo.gms(119) 3 Mb
--- .. alfa.txt(1) 3 Mb
--- . param_definition_cvx-blo.gms(124) 3 Mb
--- .. current_iter.txt(1) 3 Mb
--- . param_definition_cvx-blo.gms(128) 3 Mb
--- .. niters.txt(1) 3 Mb
--- . param_definition_cvx-blo.gms(132) 3 Mb
--- .. gamma.txt(1) 3 Mb
--- . param_definition_cvx-blo.gms(144) 3 Mb
--- cvx-sl.gms(428) 3 Mb
--- Starting execution: elapsed 0:00:00.011
--- cvx-sl.gms(667) 4 Mb
--- Generating NLP model netplan
--- cvx-sl.gms(669) 6 Mb
---   460 rows  446 columns  1,956 non-zeroes
---   256 nl-code  64 nl-non-zeroes
--- Range statistics (absolute non-zero finite values)
--- RHS       [min, max] : [ 1.000E-04, 1.000E+05] - Zero values observed as well
--- Bound     [min, max] : [ 1.000E-04, 1.000E+00] - Zero values observed as well
--- Matrix    [min, max] : [ 2.500E-05, 2.069E+07]
--- cvx-sl.gms(669) 4 Mb
--- Executing MOSEK (Solvelink=2): elapsed 0:00:00.025

MOSEK            50.4.1 84b10359 Aug 28, 2025          WEI x86 64bit/MS Window

	M O S E K       version 11.0.28 (Build date: 2025-8-25 13:05:23)
	Copyright (C)   MOSEK ApS, Fruebjergvej 3, Box 16
	                DK-2100 Copenhagen, Denmark
	                https://www.mosek.com


Extraction of quadratics (ThreePass algorithm): 0.00s
Problem
  Name                   :                 
  Objective sense        : minimize        
  Type                   : CONIC (conic optimization problem)
  Constraints            : 459             
  Affine conic cons.     : 0               
  Disjunctive cons.      : 0               
  Cones                  : 32              
  Scalar variables       : 445             
  Matrix variables       : 0               
  Integer variables      : 0               

Optimizer started.
Presolve started.
Linear dependency checker started.
Linear dependency checker terminated.
Eliminator started.
Freed constraints in eliminator : 33
Eliminator terminated.
Eliminator - tries                  : 1                 time                   : 0.00            
Lin. dep.  - tries                  : 1                 time                   : 0.00            
Lin. dep.  - primal attempts        : 1                 successes              : 1               
Lin. dep.  - dual attempts          : 0                 successes              : 0               
Lin. dep.  - primal deps.           : 12                dual deps.             : 0               
Presolve terminated. Time: 0.00    
Optimizer  - threads                : 16              
Optimizer  - solved problem         : the primal      
Optimizer  - Constraints            : 127             
Optimizer  - Cones                  : 24              
Optimizer  - Scalar variables       : 297               conic                  : 72              
Optimizer  - Semi-definite variables: 0                 scalarized             : 0               
Factor     - setup time             : 0.00            
Factor     - dense det. time        : 0.00              GP order time          : 0.00            
Factor     - nonzeros before factor : 1263              after factor           : 1600            
Factor     - dense dim.             : 0                 flops                  : 3.41e+04        
ITE PFEAS    DFEAS    GFEAS    PRSTATUS   POBJ              DOBJ              MU       TIME  
0   2.5e+04  4.5e+04  1.3e+04  0.00e+00   1.511796359e+03   -1.120109349e+04  1.0e+00  0.00  
1   8.1e+03  1.5e+04  7.2e+03  -1.00e+00  -5.085922342e+04  -6.357078841e+04  3.2e-01  0.00  
2   1.3e+03  2.4e+03  2.9e+03  -1.00e+00  -2.871157261e+05  -2.998151720e+05  5.4e-02  0.00  
3   2.6e+02  4.7e+02  1.3e+03  -1.00e+00  -6.921324374e+05  -7.047603356e+05  1.0e-02  0.00  
4   8.2e+01  1.5e+02  7.3e+02  -1.00e+00  -9.976587494e+04  -1.121847305e+05  3.3e-03  0.00  
5   1.1e+01  2.0e+01  2.7e+02  -9.99e-01  -5.787605748e+05  -5.891718209e+05  4.4e-04  0.00  
6   1.1e+00  2.0e+00  8.2e+01  -9.87e-01  -1.609583861e+06  -1.600913585e+06  4.5e-05  0.00  
7   1.9e-01  3.4e-01  2.6e+01  -8.54e-01  -4.047380061e+06  -3.979474960e+06  7.5e-06  0.00  
8   4.5e-02  8.2e-02  1.9e+00  2.77e-01   -8.236110178e+05  -8.191934663e+05  1.8e-06  0.00  
9   1.2e-02  2.1e-02  2.8e-01  7.73e-01   -2.003068341e+05  -1.987803518e+05  4.7e-07  0.00  
10  8.8e-04  1.6e-03  6.2e-03  9.46e-01   -1.775424726e+04  -1.760846418e+04  3.5e-08  0.00  
11  2.9e-04  5.2e-04  9.6e-04  1.30e+00   -4.488357650e+03  -4.457099150e+03  1.1e-08  0.00  
12  6.3e-05  1.1e-04  7.9e-05  1.43e+00   4.186506672e+02   4.225389961e+02   2.5e-09  0.00  
13  9.9e-06  1.8e-05  4.4e-06  1.28e+00   1.598163091e+03   1.598626711e+03   3.9e-10  0.00  
14  2.6e-06  4.7e-06  5.7e-07  1.13e+00   1.750286610e+03   1.750405452e+03   1.0e-10  0.01  
15  5.7e-07  1.0e-06  6.0e-08  1.07e+00   1.788737059e+03   1.788764096e+03   2.3e-11  0.01  
16  1.9e-07  3.5e-07  1.2e-08  1.03e+00   1.795793378e+03   1.795803234e+03   7.7e-12  0.01  
17  1.1e-07  2.0e-07  5.4e-09  1.01e+00   1.796563816e+03   1.796570216e+03   4.4e-12  0.01  
18  9.8e-09  1.8e-08  1.5e-10  1.00e+00   1.798309616e+03   1.798310191e+03   3.9e-13  0.01  
19  1.6e-09  3.0e-09  9.8e-12  1.00e+00   1.798445141e+03   1.798445237e+03   6.5e-14  0.01  
Optimizer terminated. Time: 0.01    


Interior-point solution summary
  Problem status  : PRIMAL_AND_DUAL_FEASIBLE
  Solution status : OPTIMAL
  Primal.  obj: 1.7984451414e+03    nrm: 7e+03    Viol.  con: 4e-04    var: 5e-07    cones: 0e+00  
  Dual.    obj: 1.7984452371e+03    nrm: 5e+05    Viol.  con: 2e-04    var: 2e-04    cones: 0e+00  

Return code - 0 [MSK_RES_OK]: No error occurred.
--- Reading solution for model netplan
--- Executing after solve: elapsed 0:00:00.089
--- cvx-sl.gms(682) 4 Mb
--- GDX File (execute_unload) C:\Users\freal\Desktop\HubSpokeNetworkDesign\4node_spain\resultado.gdx
--- cvx-sl.gms(691) 6 Mb
--- Initialize embedded library embconnectcclib64.dll
--- Execute embedded library embconnectcclib64.dll
--- cvx-sl.gms(704) 6 Mb
--- Initialize embedded library embconnectcclib64.dll
--- Execute embedded library embconnectcclib64.dll
--- cvx-sl.gms(717) 7 Mb
--- Initialize embedded library embconnectcclib64.dll
--- Execute embedded library embconnectcclib64.dll
--- Putfile fijx C:\Users\freal\Desktop\HubSpokeNetworkDesign\4node_spain\fij_long.csv
*** Status: Normal completion
--- Job cvx-sl.gms Stop 02/05/26 12:14:46 elapsed 0:00:00.762
