
--- Job cvx-ll.gms Start 02/17/26 12:16:18 50.4.1 84b10359 WEX-WEI x86 64bit/MS Windows
--- Applying:
    C:\GAMS\50\gmsprmNT.txt
--- GAMS Parameters defined
    Input C:\Users\freal\Desktop\HubSpokeNetworkDesign\6node_spain\cvx-ll.gms
    PageSize 0
    ScrDir C:\Users\freal\Desktop\HubSpokeNetworkDesign\6node_spain\225ar\
    SysDir C:\GAMS\50\
    LogOption 3
    AppendLog 1
    ErrMsg 1
    ErrorLog 99
    IDE 1
    LstTitleLeftAligned 1
*** Time-limited license expired 9 days ago
Licensee: Luis Cadarso Morga                             G250911+0003Ac-GEN
          University Rey Juan Carlos                                DCE4613
          225ar\gamslice.dat
          node:23539203 mem:64 cores:8 ipport:61117 v:2                    
          Course license for use within the course and related course work
System information: 8 physical cores and 64 Gb physical memory detected
GAMS 50.4.1   Copyright (C) 1987-2025 GAMS Development. All rights reserved
--- Starting compilation
--- cvx-ll.gms(2) 2 Mb
--- . param_definition_cvx-blo.gms(18) 3 Mb
--- .. demand.txt(36) 3 Mb
--- . param_definition_cvx-blo.gms(26) 3 Mb
--- .. alt_utility.txt(36) 3 Mb
--- . param_definition_cvx-blo.gms(33) 3 Mb
--- .. link_cost.txt(36) 3 Mb
--- . param_definition_cvx-blo.gms(38) 3 Mb
--- .. link_capacity_slope.txt(36) 3 Mb
--- . param_definition_cvx-blo.gms(43) 3 Mb
--- .. alfa_od.txt(36) 3 Mb
--- . param_definition_cvx-blo.gms(48) 3 Mb
--- .. beta_od.txt(36) 3 Mb
--- . param_definition_cvx-blo.gms(53) 3 Mb
--- .. prices.txt(36) 3 Mb
--- . param_definition_cvx-blo.gms(58) 3 Mb
--- .. op_link_cost.txt(36) 3 Mb
--- . param_definition_cvx-blo.gms(65) 3 Mb
--- .. candidates.txt(36) 3 Mb
--- . param_definition_cvx-blo.gms(70) 3 Mb
--- .. travel_time.txt(36) 3 Mb
--- . param_definition_cvx-blo.gms(76) 3 Mb
--- .. station_cost.txt(6) 3 Mb
--- . param_definition_cvx-blo.gms(81) 3 Mb
--- .. hub_cost.txt(6) 3 Mb
--- . param_definition_cvx-blo.gms(86) 3 Mb
--- .. station_capacity_slope.txt(6) 3 Mb
--- . param_definition_cvx-blo.gms(91) 3 Mb
--- .. budget.txt(1) 3 Mb
--- . param_definition_cvx-blo.gms(96) 3 Mb
--- .. f_bounds.txt(36) 3 Mb
--- . param_definition_cvx-blo.gms(102) 3 Mb
--- .. s_prev.txt(6) 3 Mb
--- . param_definition_cvx-blo.gms(107) 3 Mb
--- .. sh_prev.txt(6) 3 Mb
--- . param_definition_cvx-blo.gms(123) 3 Mb
--- .. lam.txt(1) 3 Mb
--- . param_definition_cvx-blo.gms(127) 3 Mb
--- .. alfa.txt(1) 3 Mb
--- . param_definition_cvx-blo.gms(132) 3 Mb
--- .. current_iter.txt(1) 3 Mb
--- . param_definition_cvx-blo.gms(136) 3 Mb
--- .. niters.txt(1) 3 Mb
--- . param_definition_cvx-blo.gms(140) 3 Mb
--- .. gamma.txt(1) 3 Mb
--- . param_definition_cvx-blo.gms(152) 3 Mb
--- cvx-ll.gms(358) 3 Mb
--- $echo File C:\Users\freal\Desktop\HubSpokeNetworkDesign\6node_spain\mosek.opt
--- cvx-ll.gms(458) 3 Mb
--- Starting execution: elapsed 0:00:00.025
--- cvx-ll.gms(949) 4 Mb
--- Generating NLP model netplan
--- cvx-ll.gms(953) 7 Mb
---   1,382 rows  1,710 columns  8,964 non-zeroes
---   576 nl-code  144 nl-non-zeroes
--- Range statistics (absolute non-zero finite values)
--- RHS       [min, max] : [ 1.000E-06, 1.000E+07] - Zero values observed as well
--- Bound     [min, max] : [ 1.000E-06, 1.000E+00] - Zero values observed as well
--- Matrix    [min, max] : [ 1.000E-06, 5.934E+05]
--- cvx-ll.gms(953) 5 Mb
--- Executing MOSEK (Solvelink=2): elapsed 0:00:00.044

MOSEK            50.4.1 84b10359 Aug 28, 2025          WEI x86 64bit/MS Window

	M O S E K       version 11.0.28 (Build date: 2025-8-25 13:05:23)
	Copyright (C)   MOSEK ApS, Fruebjergvej 3, Box 16
	                DK-2100 Copenhagen, Denmark
	                https://www.mosek.com

Reading parameter(s) from "C:\Users\freal\Desktop\HubSpokeNetworkDesign\6node_spain\mosek.opt"
>>  MSK_DPAR_INTPNT_TOL_REL_GAP   1e-14
>>  MSK_DPAR_INTPNT_TOL_PFEAS     1e-14
>>  MSK_DPAR_INTPNT_TOL_DFEAS     1e-14
>>  MSK_DPAR_BASIS_REL_TOL_S      1e-14
Finished reading from "C:\Users\freal\Desktop\HubSpokeNetworkDesign\6node_spain\mosek.opt"

Extraction of quadratics (ThreePass algorithm): 0.00s
Problem
  Name                   :                 
  Objective sense        : minimize        
  Type                   : CONIC (conic optimization problem)
  Constraints            : 1381            
  Affine conic cons.     : 0               
  Disjunctive cons.      : 0               
  Cones                  : 72              
  Scalar variables       : 1709            
  Matrix variables       : 0               
  Integer variables      : 0               

Optimizer started.
Presolve started.
Linear dependency checker started.
Linear dependency checker terminated.
Eliminator started.
Freed constraints in eliminator : 48
Eliminator terminated.
Eliminator - tries                  : 1                 time                   : 0.00            
Lin. dep.  - tries                  : 1                 time                   : 0.00            
Lin. dep.  - primal attempts        : 1                 successes              : 1               
Lin. dep.  - dual attempts          : 0                 successes              : 0               
Lin. dep.  - primal deps.           : 30                dual deps.             : 0               
Presolve terminated. Time: 0.00    
Optimizer  - threads                : 16              
Optimizer  - solved problem         : the primal      
Optimizer  - Constraints            : 401             
Optimizer  - Cones                  : 60              
Optimizer  - Scalar variables       : 1358              conic                  : 180             
Optimizer  - Semi-definite variables: 0                 scalarized             : 0               
Factor     - setup time             : 0.00            
Factor     - dense det. time        : 0.00              GP order time          : 0.00            
Factor     - nonzeros before factor : 5830              after factor           : 9605            
Factor     - dense dim.             : 0                 flops                  : 3.82e+05        
ITE PFEAS    DFEAS    GFEAS    PRSTATUS   POBJ              DOBJ              MU       TIME  
0   2.5e+06  1.3e+04  3.5e+04  0.00e+00   1.146597260e+05   1.498697723e+05   1.0e+00  0.01  
1   1.4e+06  7.0e+03  2.6e+04  -1.00e+00  1.475657792e+05   1.827766444e+05   5.6e-01  0.01  
2   2.5e+05  1.3e+03  1.1e+04  -1.00e+00  6.227571052e+05   6.579759329e+05   1.0e-01  0.01  
3   7.5e+04  3.8e+02  6.1e+03  -1.00e+00  2.271493634e+06   2.306735358e+06   3.0e-02  0.01  
4   5.2e+04  2.6e+02  5.1e+03  -1.00e+00  1.376553655e+06   1.411797687e+06   2.1e-02  0.01  
5   1.1e+04  5.3e+01  2.3e+03  -9.99e-01  2.158248450e+06   2.193567131e+06   4.2e-03  0.01  
6   1.2e+03  6.1e+00  7.5e+02  -9.90e-01  1.589172627e+06   1.624817991e+06   4.8e-04  0.01  
7   2.1e+02  1.1e+00  2.6e+02  -8.98e-01  3.413064760e+05   3.756903438e+05   8.4e-05  0.01  
8   1.2e+02  6.2e-01  9.0e+01  2.25e-01   2.719682401e+05   2.887665449e+05   5.0e-05  0.01  
9   3.7e+01  1.9e-01  1.0e+01  9.04e-01   1.313244699e+05   1.354993529e+05   1.5e-05  0.01  
10  1.3e+01  6.6e-02  2.4e+00  9.77e-01   9.500366588e+04   9.654664883e+04   5.3e-06  0.01  
11  4.5e+00  2.3e-02  4.7e-01  1.10e+00   7.767022198e+04   7.815515615e+04   1.8e-06  0.01  
12  2.3e+00  1.2e-02  1.7e-01  1.23e+00   7.599171466e+04   7.622343877e+04   9.3e-07  0.01  
13  1.3e+00  6.4e-03  6.9e-02  1.20e+00   7.487190723e+04   7.499161419e+04   5.1e-07  0.01  
14  6.2e-01  3.1e-03  2.4e-02  1.10e+00   7.426740081e+04   7.432580984e+04   2.5e-07  0.01  
15  4.3e-01  2.2e-03  1.4e-02  9.84e-01   7.429015947e+04   7.433179204e+04   1.7e-07  0.01  
16  2.5e-01  1.3e-03  6.7e-03  9.72e-01   7.436017677e+04   7.438534221e+04   1.0e-07  0.01  
17  2.1e-01  1.0e-03  5.1e-03  8.54e-01   7.441451605e+04   7.443596029e+04   8.2e-08  0.01  
18  1.1e-01  5.7e-04  2.1e-03  9.27e-01   7.451845569e+04   7.453055293e+04   4.6e-08  0.01  
19  8.4e-02  4.2e-04  1.5e-03  7.85e-01   7.457290669e+04   7.458282298e+04   3.3e-08  0.02  
20  2.6e-02  1.3e-04  2.7e-04  8.57e-01   7.470563799e+04   7.470892363e+04   1.0e-08  0.02  
21  1.5e-02  7.4e-05  1.4e-04  6.09e-01   7.476638441e+04   7.476876732e+04   5.9e-09  0.02  
22  1.1e-02  5.3e-05  9.7e-05  5.18e-01   7.480696487e+04   7.480900022e+04   4.2e-09  0.02  
23  9.0e-03  4.5e-05  8.4e-05  2.69e-01   7.483123402e+04   7.483320066e+04   3.6e-09  0.02  
24  8.2e-03  4.1e-05  7.3e-05  3.61e-01   7.484479227e+04   7.484660361e+04   3.3e-09  0.02  
25  7.4e-03  3.7e-05  6.9e-05  1.94e-01   7.485791515e+04   7.485979074e+04   2.9e-09  0.02  
26  6.4e-03  3.2e-05  5.9e-05  2.48e-01   7.487867688e+04   7.488042257e+04   2.6e-09  0.02  
27  3.8e-03  1.9e-05  3.1e-05  2.94e-01   7.495119264e+04   7.495246542e+04   1.5e-09  0.02  
28  3.2e-03  1.6e-05  2.9e-05  1.28e-01   7.497004965e+04   7.497143192e+04   1.3e-09  0.02  
29  1.5e-03  7.8e-06  1.1e-05  3.85e-01   7.506018756e+04   7.506094592e+04   6.2e-10  0.02  
30  1.1e-03  5.6e-06  7.8e-06  2.59e-01   7.509881352e+04   7.509952490e+04   4.4e-10  0.02  
31  3.0e-04  1.5e-06  1.5e-06  5.02e-01   7.521286580e+04   7.521314571e+04   1.2e-10  0.02  
32  1.2e-04  6.3e-07  5.3e-07  4.90e-01   7.526618517e+04   7.526636219e+04   5.0e-11  0.02  
33  5.2e-05  2.6e-07  1.6e-07  7.49e-01   7.529832730e+04   7.529841296e+04   2.1e-11  0.02  
34  1.5e-05  7.8e-08  3.1e-08  7.42e-01   7.532038628e+04   7.532042081e+04   6.2e-12  0.02  
35  8.6e-06  4.3e-08  1.5e-08  7.07e-01   7.532726182e+04   7.532728604e+04   3.4e-12  0.02  
36  2.8e-06  1.4e-08  3.1e-09  8.41e-01   7.533412129e+04   7.533413066e+04   1.1e-12  0.02  
37  1.8e-06  9.0e-09  1.7e-09  7.52e-01   7.533570832e+04   7.533571535e+04   7.2e-13  0.02  
38  5.5e-07  2.8e-09  3.2e-10  8.75e-01   7.533788743e+04   7.533788987e+04   2.2e-13  0.02  
39  3.0e-07  1.5e-09  1.5e-10  7.78e-01   7.533839801e+04   7.533839966e+04   1.2e-13  0.03  
40  1.3e-07  6.3e-10  4.2e-11  8.83e-01   7.533880927e+04   7.533881002e+04   5.0e-14  0.03  
41  4.0e-08  2.0e-10  8.2e-12  8.56e-01   7.533905935e+04   7.533905963e+04   1.6e-14  0.03  
Optimizer terminated. Time: 0.03    


Interior-point solution summary
  Problem status  : PRIMAL_AND_DUAL_FEASIBLE
  Solution status : OPTIMAL
  Primal.  obj: 7.5339059347e+04    nrm: 1e+05    Viol.  con: 2e-02    var: 2e-09    cones: 0e+00  
  Dual.    obj: 7.5339059631e+04    nrm: 5e+08    Viol.  con: 1e-06    var: 2e-05    cones: 0e+00  

Return code - 0 [MSK_RES_OK]: No error occurred.
--- Reading solution for model netplan
--- Executing after solve: elapsed 0:00:00.132
--- cvx-ll.gms(966) 5 Mb
--- GDX File (execute_unload) C:\Users\freal\Desktop\HubSpokeNetworkDesign\6node_spain\resultado.gdx
--- cvx-ll.gms(975) 7 Mb
--- Initialize embedded library embconnectcclib64.dll
--- Execute embedded library embconnectcclib64.dll
--- cvx-ll.gms(988) 7 Mb
--- Initialize embedded library embconnectcclib64.dll
--- Execute embedded library embconnectcclib64.dll
--- cvx-ll.gms(1001) 8 Mb
--- Initialize embedded library embconnectcclib64.dll
--- Execute embedded library embconnectcclib64.dll
--- Putfile fijx C:\Users\freal\Desktop\HubSpokeNetworkDesign\6node_spain\fij_long.csv
*** Status: Normal completion
--- Job cvx-ll.gms Stop 02/17/26 12:16:19 elapsed 0:00:00.832
